{
  "eventId": "3f1c9a52-0000-4000-8000-000000000001",
  "occurredAtUtc": "2026-08-27T10:00:00Z",
  "producer": "dp-core",
  "organization": "acme",
  "entity": { "kind": "placement", "instanceId": "cache-prod-01", "placementId": "pl-eu-1" },
  "stateVersion": 41,
  "event": "instance.health",
  "payload": { "state": "RED" }
}
