{
  "eventId": "3f1c9a52-0000-4000-8000-000000000002",
  "occurredAtUtc": "2026-08-27T10:00:05Z",
  "producer": "dp-core",
  "organization": "acme",
  "entity": { "kind": "instance", "instanceId": "cache-prod-01" },
  "stateVersion": 7,
  "event": "instance.config-state",
  "payload": { "reached": "restart-observed" }
}
